{
  "schema_version": "pam-manifest/0.1.0",
  "project": {"name": "promotion-assurance-program", "repository": null, "phase": "projectization preflight complete; owner review required before implementation bootstrap"},
  "methodology": {"repository": "Pukujan/project-assurance-modules", "revision": "8f4737fc212e6b09f8066d90e178aa8760e619fb"},
  "project_facts": {
    "project_type": "research-backed software composition with a bounded first-domain integration", "agent_assisted_development": true, "material_cross_session_work": true, "multiple_existing_systems": true, "proposed_new_repository": true, "persistent_state": true, "replay_rebuild_requirement": true, "authorization_and_actor_attribution_boundary": true, "external_network_dependencies": "development and source acquisition may use them; CI should be deterministic and no-network where feasible", "empirical_quality_claims": true, "benchmark_or_dataset_use": true, "hidden_confirmatory_evaluation": "conditional on adaptive tuning or empirical release claims", "domain_temporal_version_semantics": true, "human_review_for_consequential_promotion": true, "consequential_external_actions": false, "durable_provenance_and_decision_lineage": true, "public_release_expectation": "not yet decided", "research_maturity": "sufficient for preflight; unresolved implementation and evidence questions remain"
  },
  "profiles": [],
  "modules": [
    {
      "module_id": "projectization.scope-boundary", "version": "0.1.0", "disposition": "required", "rationale": "This is a nontrivial transition from research to a multi-system implementation program with many attractive adjacent mechanisms.",
      "requirements": [
        {"requirement_id": "SCOPE_001", "state": "satisfied", "evidence": [{"kind": "file", "locator": "SCOPE.md", "note": "States the current outcome and bounded capabilities."}], "rationale": null},
        {"requirement_id": "SCOPE_002", "state": "satisfied", "evidence": [{"kind": "file", "locator": "SCOPE.md", "note": "Lists explicit non-goals."}], "rationale": null},
        {"requirement_id": "SCOPE_003", "state": "satisfied", "evidence": [{"kind": "file", "locator": "SCOPE.md", "note": "Records deferred/rejected mechanisms and triggers."}], "rationale": null},
        {"requirement_id": "SCOPE_004", "state": "satisfied", "evidence": [{"kind": "file", "locator": "SCOPE.md", "note": "Defines the admission and disposition rule."}], "rationale": null},
        {"requirement_id": "SCOPE_005", "state": "satisfied", "evidence": [{"kind": "file", "locator": "REPOSITORY_MAP.md", "note": "Defines ownership and must-not-own boundaries."}], "rationale": null}
      ]
    },
    {
      "module_id": "projectization.build-vs-reuse", "version": "0.1.0", "disposition": "required", "rationale": "The packet names several independently developed capabilities that are plausible components; bespoke work is not presumptively authorized.",
      "requirements": [
        {"requirement_id": "REUSE_001", "state": "satisfied", "evidence": [{"kind": "file", "locator": "BUILD_VS_REUSE.md", "note": "Defines scoped capability requirements and decision criteria."}], "rationale": null},
        {"requirement_id": "REUSE_002", "state": "pending", "evidence": [], "rationale": "The packet identifies candidates but does not provide immutable component revisions or licenses; M0 must obtain owner-approved pins without live discovery in this run."},
        {"requirement_id": "REUSE_003", "state": "pending", "evidence": [], "rationale": "Proposed dispositions await owner review and version-pinned compatibility evidence."},
        {"requirement_id": "REUSE_004", "state": "pending", "evidence": [], "rationale": "M0 probes will test FOSSIL boundary behavior and composition compatibility before bespoke build."},
        {"requirement_id": "REUSE_005", "state": "pending", "evidence": [], "rationale": "This candidate bundle records proposed dispositions; human-reviewed decision occurs at preflight approval."},
        {"requirement_id": "REUSE_006", "state": "pending", "evidence": [], "rationale": "The only proposed build_new work is a thin promotion-policy adapter, justified provisionally and subject to a compatibility probe."}
      ]
    },
    {
      "module_id": "continuity.structured-handoff", "version": "0.1.0", "disposition": "required", "rationale": "The work is agent-assisted, multi-session, and coordinates independently versioned systems and future evaluation artifacts.",
      "requirements": [
        {"requirement_id": "HANDOFF-001", "state": "pending", "evidence": [], "rationale": "M0 must commit handoff authority and stale-state rules before implementation agents begin."},
        {"requirement_id": "HANDOFF-002", "state": "pending", "evidence": [], "rationale": "HANDOFF_STATE.json is a planning checkpoint, not the future project-local state packet."},
        {"requirement_id": "HANDOFF-003", "state": "pending", "evidence": [], "rationale": "The project must select a schema and add deterministic positive and negative validation in M0."},
        {"requirement_id": "HANDOFF-004", "state": "pending", "evidence": [], "rationale": "Resume reconciliation instructions must be implemented and tested in the new project."},
        {"requirement_id": "HANDOFF-005", "state": "pending", "evidence": [], "rationale": "The project must define replaceable current state and immutable historical checkpoint retention."},
        {"requirement_id": "HANDOFF-006", "state": "pending", "evidence": [], "rationale": "Applicable if adaptive/hidden evaluation is introduced; policy and fixture boundary belong in M0 before such data is present."}
      ]
    }
  ]
}
